{
  "id": "voice/operator",
  "version": 1,
  "language": "ko",
  "name": "운영자 문체 v1 — 운영자의 한국어 두 작품 656화에서 잰 문체 (ADR-0083)",
  "evidence": "docs/10-corpus/operator-voice-analysis.md (C0.3) and docs/10-corpus/corpus-stats.md (C1): books 1 and 2 of sigma43web/ko-corpus, 656 Korean main-story chapters; book 3 is a machine translation and excluded.",
  "writer": [
    "화의 첫 줄은 목소리로 연다: 소리 한 줄, 용어 한 줄, 대사 한마디. 풍경 묘사, 잠에서 깨는 장면, 죽는 순간의 감각 회상으로 열지 않는다. 앞 화에서 이어지는 화는 직전 절단의 순간에서 바로 다시 시작하고, 앞 화를 요약하며 열지 않는다.",
    "대사와 속마음은 합쳐서 글자 수의 20~35%를 차지한다(작가의 1인칭 화 중앙값 23%, 1~25화 25%). 인물이 혼자 있는 장면이 길어지면 다른 인물을 등장시키거나 짧은 속마음으로 호흡을 끊는다.",
    "대사 한 줄 뒤에는 서술 비트 한 줄이 온다. 대사 줄 안에 ‘~라고 말했다’ 같은 말꼬리표를 넣지 않고, 옆 서술 줄이 화자와 반응을 보여 준다. 네 줄 넘게 대사만 잇는 것은 만담 장면에서만 한다.",
    "침묵도 한 줄이다: “…….” 한 줄로 반응을 대신할 수 있다.",
    "속마음은 대부분 자유간접 서술로 흘린다(‘-가.’, ‘-겠지.’, 짧은 조각문). 작은따옴표 속마음은 짧고 거친 반말이고, 겉으로 하는 말과의 온도 차가 웃음이 된다. 속마음에는 존댓말을 쓰지 않는다.",
    "한 줄에 한 문단, 한 문단에 한 문장이 기본이다. 문단은 30자 안팎이고 100자를 넘기지 않는다. 열 자 이하의 짧은 줄을 자주 둔다.",
    "서술 문장은 27자 안팎이고 60자를 넘는 문장은 스무 문장에 하나를 넘지 않는다.",
    "문장 끝은 과거형 ‘-었다’를 중심으로 현재형 ‘-ㄴ다’, 명사형이나 조각문 끝맺음(‘…이빨을 깨무는 그녀.’), 걸린 연결형(‘…했으나.’)을 섞는다. 같은 어미를 세 문장 넘게 잇지 않는다.",
    "비트 줄을 쓴다: 효과음은 동작 앞에 한 줄로(‘까득.’), ‘그런데.’ ‘하지만.’ 같은 접속어 한 줄, ‘한 걸음. / 두 걸음.’ 같은 단계 줄, 질문 뒤에 잘린 대답.",
    "줄표(—)는 쓰지 않는다. 말이 끊길 때는 붙임표(‘무슨 일이십니-’)나 말줄임표를 쓴다. 물결표는 장난스러운 말투에만 쓰고, 쉼표는 아낀다.",
    "직유는 천 자에 한 번도 쓰지 않는 것이 보통이다. 닳은 비유(뱀 같은 눈, 비릿하게 말려 올라가는 입꼬리)는 쓰지 않는다. 1인칭 서술에서는 ‘그/그녀’를 피하고 이름과 호칭으로 부른다.",
    "만담에서 주인공은 무표정하게 받는 쪽이거나 정중하게 놀리는 쪽이다. 상대의 말버릇 따라 하기, 상대가 속으로 한 말을 입 밖에 내기, 일부러 잘못 알아듣기, 과한 칭찬, ‘장난입니다’ 같은 후퇴로 치고, 반응은 한 단어 줄(‘빠직.’)로 받는다.",
    "착각은 설명하지 않는다: 독자는 주인공의 진짜 실력을 알고, 주변 인물은 그것을 그럴듯하게 틀리게 읽는다. 인물의 오판과 주인공 속마음 사이의 온도 차로 보여 준다.",
    "사이다는 한두 화에 한 번, 주인공을 의심하던 인물의 눈으로 실력이 드러나는 순간이다. 고구마는 한 화를 넘기지 않는다.",
    "설정은 강의로 풀지 않는다. 규칙은 사건 한가운데서 한두 줄로 주고, 나머지는 결과로 보여 준다.",
    "절단은 결단이나 선언의 대사, 위협, 반전, 폭로, 새 인물의 등장, 웃음 한 방으로 한다. 요약, 교훈, 하루를 마무리하는 문장으로 끝내지 않는다.",
    "상태창은 짧은 대괄호 블록(‘[특성 : …]’, ‘[메인 퀘스트 : …]’과 붙임표로 시작하는 목표 줄)이고, 시스템의 목소리가 비꼬아도 된다. 계획에 없으면 쓰지 않는다."
  ],
  "planner": [
    "한 화에는 핵심 사건이 하나이고 장면은 한두 개다. 1~25화에서는 시간을 건너뛰지 않는다.",
    "화의 첫 비트는 목소리(소리, 용어, 대사)로 열고, 앞 화가 있으면 직전 절단의 순간에서 이어받는다. 앞 화 요약으로 열지 않는다.",
    "모든 화에는 주인공과 말을 주고받는 인물이 무대에 있는 장면이 적어도 하나 있다. 대사와 속마음이 글자 수의 20~35%에 이르도록 대사 비트를 계획한다. 주인공 혼자 회상하거나 설명하는 장면을 화의 대부분으로 두지 않는다.",
    "설정과 미래 지식은 한 장면에 몰아 설명하지 않는다. 사건 한가운데서 한두 줄로 주고, 나머지는 다음 화들의 결과로 나눈다.",
    "사이다는 한두 화에 한 번, 주인공을 의심하던 인물이 보는 앞에서 터진다. 고구마는 한 화를 넘기지 않는다.",
    "히로인은 위기나 충돌 속에서 등장한다: 외모 한두 조각, 이름 한 줄, 집안과 위치, 주인공이 아는 그녀의 운명이나 비밀, 그리고 주인공이 건드릴 약점이나 퀘스트. 호감은 히로인 쪽에서 먼저 움직이고 주인공은 쫓지 않는다.",
    "절단은 결단이나 선언, 위협, 반전, 폭로, 등장, 웃음 한 방 가운데 하나로 계획한다. 요약이나 하루 마무리로 끝나는 화는 계획하지 않는다."
  ],
  "judges": [
    "한 줄에 한 문단, 열 자 이하의 짧은 줄, 효과음이나 접속어만 있는 줄은 이 작가의 리듬이다. 문단이 짧다는 이유로 지적하지 않는다.",
    "곧은 따옴표(\")로 쓴 대사는 굽은 따옴표와 같다. 따옴표 모양을 지적하지 않는다.",
    "과거형 사이에 현재형, 명사형, 조각문 끝맺음이 섞이는 것은 이 작가의 문체다. 시제 혼란으로 지적하지 않는다.",
    "말이 끊길 때 붙임표(‘-’)로 끝나는 대사와 “…….” 한 줄 대사는 결함이 아니다.",
    "‘빌어먹을’, ‘염병’ 같은 거친 감탄은 이 작가가 쓰는 말이다. 번역투로 지적하지 않고, 같은 욕설이 한 화에 세 번 넘게 반복될 때만 반복으로 지적한다.",
    "‘* * *’나 ‘*’ 한 줄은 장면 전환이다.",
    "속마음의 거친 반말과 겉말의 존댓말 사이 온도 차는 인물 붕괴가 아니라 웃음 장치다.",
    "대사 비중의 숫자는 결정적 검사가 따로 잰다. 판정자는 대사가 있는 장면의 주고받음과 반응을 평가한다."
  ]
}
